{
  "id": "com.agentconnect.agentic-notes",
  "name": "Agentic Notes",
  "version": "0.1.0",
  "description": "Local knowledge concierge for chat-first notes and documents.",
  "entry": {
    "type": "web",
    "path": "dist/index.html",
    "devUrl": "http://localhost:5173"
  },
  "capabilities": [
    "agent.connect",
    "model.claude",
    "model.codex",
    "model.local"
  ],
  "providers": ["claude", "codex", "local"],
  "models": { "default": "claude-sonnet" },
  "icon": "icon.svg",
  "license": "MIT"
}
