{
  "id": "com.agentconnect.sheets-ai",
  "name": "Sheets AI",
  "version": "0.1.0",
  "description": "AI-powered spreadsheet editor with local file storage and version history.",
  "entry": {
    "type": "web",
    "path": ".next",
    "devUrl": "http://localhost:3000"
  },
  "capabilities": ["agent.connect", "model.claude", "model.codex", "model.local"],
  "providers": ["claude", "codex", "local"],
  "models": { "default": "claude-sonnet" },
  "icon": "icon.svg"
}
